estilo	livro	capitulo	versiculo	texto
NR2006	2%20Corinzi	10	6	e siamo pronti a punire ogni disubbidienza , quando la vostra ubbidienza sarà completa .
NR2006	2%20Corinzi	10	7	TR e M così anche noi siamo di Cristo . -
NR2006	2%20Corinzi	10	8	Infatti , se anche volessi vantarmi un po ’ più della nostra autorità , che il Signore &#91; ci &#93; ha data per la vostra edificazione e non per la vostra rovina , non avrei motivo di vergognarmi .
NR2006	2%20Corinzi	10	9	:
NR2006	2%20Corinzi	10	11	Quel tale si convinca che come siamo a parole , per mezzo delle lettere , quando siamo assenti , così saremo anche a fatti quando saremo presenti .
NR2006	2%20Corinzi	10	12	( B ) Poiché noi non abbiamo il coraggio di classificarci o confrontarci con certuni che si raccomandano da sé ; i quali però , misurandosi secondo la loro propria misura e paragonandosi tra di loro stessi , mancano d ’ intelligenza .
NR2006	2%20Corinzi	10	13	Noi , invece , non ci vanteremo oltre misura , ma entro la misura del campo di attività di cui Dio ci ha segnato i limiti , dandoci di giungere anche fino a voi .
NR2006	2%20Corinzi	10	14	Noi infatti non oltrepassiamo i nostri limiti come se non fossimo giunti fino a voi ; perché siamo realmente giunti fino a voi con il vangelo di Cristo .
NR2006	2%20Corinzi	10	15	Non ci vantiamo oltre misura di fatiche altrui , ma nutriamo speranza che , crescendo la vostra fede , saremo tenuti in maggiore considerazione tra di voi nei limiti del campo di attività assegnatoci ,
NR2006	2%20Corinzi	10	16	per poter evangelizzare anche i paesi che sono al di là del vostro senza vantarci , nel campo altrui , di cose già preparate .
NR2006	2%20Corinzi	10	17	+ Gr
NR2006	2%20Corinzi	10	18	Perché non colui che si raccomanda da sé è approvato , ma colui che il Signore raccomanda . Footnotes -
NR2006	2%20Corinzi	10	24	.
NR2006	2%20Corinzi	11	2	Corinzi
NR2006	2%20Corinzi	11	11	:
NR2006	2%20Corinzi	11	2006	Servizio di Paolo contrapposto a quello dei falsi apostoli
NR2006	2%20Corinzi	11	3	Le parole e dalla purezza compaiono in NA tra parentesi ; TR e M le omettono . -
NR2006	2%20Corinzi	11	4	Infatti , se uno viene a predicarvi un altro Gesù , diverso da quello che abbiamo predicato noi , o se si tratta di ricevere uno spirito diverso da quello che avete ricevuto , o un vangelo diverso da quello che avete accettato , voi lo sopportate volentieri .
NR2006	2%20Corinzi	11	5	Inferiore a quei sommi apostoli , altri traducono : da meno dei sommi apostoli . -
NR2006	2%20Corinzi	11	6	Anche se sono rozzo nel parlare , non lo sono però nella conoscenza ; e lo abbiamo dimostrato tra di voi , in tutti i modi e in ogni cosa .
NR2006	2%20Corinzi	11	7	Ho forse commesso peccato quando , abbassando me stesso perché voi foste innalzati , vi ho annunciato il vangelo di Dio gratuitamente ?
NR2006	2%20Corinzi	11	8	Ho spogliato altre chiese , prendendo da loro un sussidio , per poter servire voi .
NR2006	2%20Corinzi	11	9	Durante il mio soggiorno tra di voi , quando mi trovai nel bisogno , non fui di peso a nessuno , perché i fratelli venuti dalla Macedonia provvidero al mio bisogno ; e in ogni cosa mi sono astenuto e mi asterrò ancora dall ’ esservi di peso .
NR2006	2%20Corinzi	11	10	Com ’ è vero che la verità di Cristo è in me , questo vanto non mi sarà tolto nelle regioni dell ’ Acaia .
NR2006	2%20Corinzi	11	12	Ma quello che faccio lo farò ancora per togliere ogni pretesto a coloro che desiderano un ’ occasione per mostrarsi uguali a noi in ciò di cui si vantano .
NR2006	2%20Corinzi	11	13	Quei tali sono falsi apostoli , operai fraudolenti che si travestono da apostoli di Cristo .
NR2006	2%20Corinzi	11	14	Non c ’ è da meravigliarsene , perché anche Satana si traveste da angelo di luce .
NR2006	2%20Corinzi	11	15	Non è dunque cosa eccezionale se anche i suoi servitori si travestono da servitori di giustizia ; la loro fine sarà secondo le loro opere . Sofferenze di Paolo
NR2006	2%20Corinzi	11	16	( B ) Nessuno , ripeto , mi prenda per pazzo ; o se no , accettatemi anche come pazzo , affinché anch ’ io possa vantarmi un po ’ .
NR2006	2%20Corinzi	11	17	Quel che dico quando mi vanto con tanta sicurezza non lo dico secondo il Signore , ma come se fossi pazzo .
NR2006	2%20Corinzi	11	18	Poiché molti si vantano secondo la carne , anch ’ io mi vanterò .
NR2006	2%20Corinzi	11	19	Ora voi , pur essendo savi , sopportate volentieri i pazzi !
NR2006	2%20Corinzi	11	20	Infatti se uno vi riduce in schiavitù , se uno vi divora , se uno vi prende il vostro , se uno s ’ innalza sopra di voi , se uno vi percuote in faccia , voi lo sopportate .
NR2006	2%20Corinzi	11	21	Lo dico a nostra vergogna , come se noi fossimo stati deboli ; eppure qualunque cosa uno osi pretendere ( parlo da pazzo ) , oso pretenderla anch ’ io .
NR2006	2%20Corinzi	11	22	Sono Ebrei ? Lo sono anch ’ io . Sono Israeliti ? Lo sono anch ’ io . Sono discendenza di Abraamo ? Lo sono anch ’ io .
NR2006	2%20Corinzi	11	23	Sono servitori di Cristo ? Io ( parlo come uno fuori di sé ) lo sono più di loro ; più di loro per le fatiche , più di loro per le prigionie , assai più di loro per le percosse subite . Spesso sono stato in pericolo di morte .
NR2006	2%20Corinzi	11	24	Dai Giudei cinque volte ho ricevuto quaranta colpi meno uno ;
NR2006	2%20Corinzi	11	25	tre volte sono stato battuto con le verghe ; una volta sono stato lapidato ; tre volte ho fatto naufragio ; ho passato un giorno e una notte negli abissi marini .
NR2006	2%20Corinzi	11	26	Spesso in viaggio , in pericolo sui fiumi , in pericolo per i briganti , in pericolo da parte dei miei connazionali , in pericolo da parte degli stranieri , in pericolo nelle città , in pericolo nei deserti , in pericolo sul mare , in pericolo tra falsi fratelli ;
NR2006	2%20Corinzi	11	27	in fatiche e in pene ; spesse volte in veglie , nella fame e nella sete , spesse volte nei digiuni , nel freddo e nella nudità .
NR2006	2%20Corinzi	11	28	Oltre a tutto il resto , sono assillato ogni giorno dalle preoccupazioni che mi vengono da tutte le chiese .
NR2006	2%20Corinzi	11	29	Chi è debole senza che io mi senta debole con lui ? Chi è scandalizzato senza che io frema per lui ?
NR2006	2%20Corinzi	11	30	Se bisogna vantarsi , mi vanterò della mia debolezza .
NR2006	2%20Corinzi	11	31	TR del nostro Signore Gesù . -
NR2006	2%20Corinzi	11	32	TR e M volendomi arrestare .
NR2006	2%20Corinzi	11	33	e da una finestra fui calato , in una cesta , lungo il muro , e scampai alle sue mani . Footnotes -
NR2006	2%20Corinzi	12	2	Corinzi
NR2006	2%20Corinzi	12	12	:
NR2006	2%20Corinzi	12	2006	La forza di Dio nella debolezza umana
NR2006	2%20Corinzi	12	3	So che quell ’ uomo ( se fu con il corpo o senza il corpo non so , Dio lo sa )
NR2006	2%20Corinzi	12	4	fu rapito in paradiso e udì parole ineffabili che non è lecito all ’ uomo pronunciare .
NR2006	2%20Corinzi	12	5	Di quel tale mi vanterò ; ma di me stesso non mi vanterò se non delle &#91; mie &#93; debolezze .
NR2006	2%20Corinzi	12	6	Pur se volessi vantarmi , non sarei un pazzo , perché direi la verità ; ma me ne astengo , perché nessuno mi stimi oltre quello che mi vede essere , o sente da me .
NR2006	2%20Corinzi	12	7	Spina corrisponde propriamente a una spina di cardo o a una scheggia di legno penetrata nella carne . Secondo l ’ opinione più verosimile , Paolo parlerebbe qui di qualche infermità fisica molto dolorosa , ma di cui si ignora la natura . -
NR2006	2%20Corinzi	12	8	Tre volte ho pregato il Signore perché l ’ allontanasse da me ;
NR2006	2%20Corinzi	12	9	ed egli mi ha detto : « La mia grazia ti basta , perché la &#91; mia &#93; potenza si dimostra perfetta nella debolezza » . Perciò molto volentieri mi vanterò piuttosto delle mie debolezze , affinché la potenza di Cristo riposi su di me .
NR2006	2%20Corinzi	12	10	Per questo mi compiaccio in debolezze , in ingiurie , in necessità , in persecuzioni , in angustie per amore di Cristo ; perché quando sono debole , allora sono forte . Disinteresse dell ’ apostolo Paolo ; i suoi timori
NR2006	2%20Corinzi	12	11	( B ) Sono diventato pazzo &#91; vantandomi &#93; ; siete voi che mi ci avete costretto ; infatti io avrei dovuto essere da voi raccomandato ; perché in nulla sono stato da meno di quei sommi apostoli , benché io non sia nulla .
NR2006	2%20Corinzi	12	13	In che cosa siete stati trattati meno bene delle altre chiese , se non nel fatto che io stesso non vi sono stato di peso ? Perdonatemi questo torto .
NR2006	2%20Corinzi	12	14	Ecco , questa è la terza volta che sono pronto a recarmi da voi ; e non vi sarò di peso , poiché io non cerco i vostri beni , ma voi ; perché non sono i figli che debbono accumulare ricchezze per i genitori , ma i genitori per i figli .
NR2006	2%20Corinzi	12	15	TR e M … per voi , anche se amandovi tanto , sono amato di meno . -
NR2006	2%20Corinzi	12	16	Vi avrei presi con inganno , è questo il linguaggio degli avversari di Paolo . -
NR2006	2%20Corinzi	12	17	Vi ho forse sfruttati per mezzo di qualcuno dei fratelli che vi ho mandati ?
NR2006	2%20Corinzi	12	18	Ho pregato Tito di venire da voi e ho mandato quell ’ altro fratello con lui . Tito ha forse approfittato di voi ? Non abbiamo noi camminato con il medesimo spirito e seguito le medesime orme ?
NR2006	2%20Corinzi	12	19	TR e M Pensate di nuovo che cerchiamo di difenderci davanti a voi ?
NR2006	2%20Corinzi	12	20	Infatti temo , quando verrò , di non trovarvi quali vorrei e di essere io stesso da voi trovato quale non mi vorreste ; temo che vi siano tra di voi contese , gelosie , ire , rivalità , maldicenze , insinuazioni , superbie , disordini ;
NR2006	2%20Corinzi	12	21	e che al mio arrivo il mio Dio abbia di nuovo a umiliarmi davanti a voi , e io debba piangere per molti di quelli che hanno peccato precedentemente e non si sono ravveduti dell ’ impurità , della fornicazione e della dissolutezza a cui si erano dati . Footnotes -
NR2006	2%20Corinzi	12	1	TR e M Certo il vantarsi non mi giova ; verrò quindi alle … -
NR2006	2%20Corinzi	13	2	Corinzi
NR2006	2%20Corinzi	13	13	:
NR2006	2%20Corinzi	13	2006	Ultime esortazioni ai Corinzi ; saluti
NR2006	2%20Corinzi	13	3	dal momento che cercate una prova che Cristo parla in me , lui che non è debole verso di voi ma è potente in mezzo a voi .
NR2006	2%20Corinzi	13	4	Infatti egli fu crocifisso per la sua debolezza , ma vive per la potenza di Dio ; anche noi siamo deboli in lui , ma vivremo con lui mediante la potenza di Dio per procedere nei vostri confronti .
NR2006	2%20Corinzi	13	5	A meno che … sia negativo , lett. a meno che non siate riprovati / squalificati . -
NR2006	2%20Corinzi	13	6	Che la prova … nostri confronti , lett. che noi non siamo riprovati / squalificati . -
NR2006	2%20Corinzi	13	7	TR e M Prego Dio …
NR2006	2%20Corinzi	13	8	Infatti non abbiamo alcun potere contro la verità ; quello che possiamo è per la verità .
NR2006	2%20Corinzi	13	9	Ci rallegriamo quando noi siamo deboli e voi siete forti ; per questo preghiamo : per il vostro perfezionamento .
NR2006	2%20Corinzi	13	10	Perciò vi scrivo queste cose mentre sono assente affinché , quando sarò presente , io non abbia a procedere rigorosamente secondo l ’ autorità che il Signore mi ha data per edificare , e non per distruggere . Ultimi consigli
NR2006	2%20Corinzi	13	11	( B ) Del resto , fratelli , rallegratevi , ricercate la perfezione , siate consolati , abbiate un medesimo sentimento , vivete in pace ; e il Dio d ’ amore e di pace sarà con voi .
NR2006	2%20Corinzi	13	12	Salutatevi gli uni gli altri con un santo bacio . Tutti i santi vi salutano .
NR2006	2%20Corinzi	13	1	+ De
NR2006	2%20Corinzi	13	19	:
NR2006	2%20Corinzi	13	15	. -
NR2006	Galati	1	1	:
NR2006	Galati	1	2006	Indirizzo e saluti ( A )
NR2006	Galati	1	2	e tutti i fratelli che sono con me , alle chiese della Galazia ;
NR2006	Galati	1	3	TR e M da Dio Padre e dal Signore nostro Gesù Cristo . - Galati
NR2006	Galati	1	4	che ha dato se stesso per i nostri peccati , per sottrarci al presente secolo malvagio , secondo la volontà del nostro Dio e Padre ,
NR2006	Galati	1	5	al quale sia la gloria nei secoli dei secoli . Amen . Rifiuto di un altro vangelo
NR2006	Galati	1	6	( C ) Mi meraviglio che così presto voi passiate da colui che vi ha chiamati mediante la grazia { di Cristo } a un altro vangelo ;
NR2006	Galati	1	7	ché poi non c ’ è un altro vangelo , però ci sono alcuni che vi turbano e vogliono sovvertire il vangelo di Cristo .
NR2006	Galati	1	8	Ma anche se noi o un angelo dal cielo { vi } annunciasse un vangelo diverso da quello che vi abbiamo annunciato , sia anatema .
NR2006	Galati	1	9	Come abbiamo già detto , lo ripeto di nuovo anche adesso : se qualcuno vi annuncia un vangelo diverso da quello che avete ricevuto , sia anatema .
NR2006	Galati	1	10	Vado forse cercando il favore degli uomini , o quello di Dio ? Oppure cerco di piacere agli uomini ? Se cercassi ancora di piacere agli uomini , non sarei servo di Cristo . Origine divina del vangelo di Paolo
NR2006	Galati	1	11	( D ) Vi dichiaro , fratelli , che il vangelo da me annunciato non è opera d ’ uomo ;
NR2006	Galati	1	12	perché io stesso non l ’ ho ricevuto né l ’ ho imparato da un uomo , ma l ’ ho ricevuto per rivelazione di Gesù Cristo .
NR2006	Galati	1	13	Infatti voi avete udito quale sia stata la mia condotta nel passato , quando ero nel giudaismo ; come perseguitavo a oltranza la chiesa di Dio , e la devastavo ;
NR2006	Galati	1	14	e mi distinguevo nel giudaismo più di molti coetanei tra i miei connazionali , perché ero estremamente zelante nelle tradizioni dei miei padri .
NR2006	Galati	1	15	Prescelto , lett. messo da parte ( cfr . Ro
NR2006	Galati	1	16	Con nessun uomo , lett. con carne e sangue . - Galati
NR2006	Galati	1	17	né salii a Gerusalemme da quelli che erano stati apostoli prima di me , ma me ne andai subito in Arabia ; quindi ritornai a Damasco .
NR2006	Galati	1	18	TR e M Pietro .
NR2006	Galati	1	19	e non vidi nessun altro degli apostoli , ma solo Giacomo , il fratello del Signore .
NR2006	Galati	1	20	Ora , riguardo a ciò che vi scrivo , ecco , vi dichiaro , davanti a Dio , che non mento .
NR2006	Galati	1	21	Poi andai nelle regioni della Siria e della Cilicia ;
NR2006	Galati	1	22	ma ero sconosciuto personalmente alle chiese di Giudea , che sono in Cristo ;
NR2006	Galati	1	23	esse sentivano soltanto dire : « Colui che una volta ci perseguitava , ora predica la fede che nel passato cercava di distruggere » .
NR2006	Galati	1	24	E per causa mia glorificavano Dio . Footnotes - Galati
NR2006	Galati	2	2	:
NR2006	Galati	2	2006	Paolo a Gerusalemme
NR2006	Galati	2	3	Ma neppure Tito , che era con me , ed era greco , fu costretto a farsi circoncidere .
NR2006	Galati	2	4	Anzi , proprio a causa di intrusi , falsi fratelli , infiltratisi di nascosto tra di noi per spiare la libertà che abbiamo in Cristo Gesù , con l ’ intenzione di renderci schiavi ,
NR2006	Galati	2	5	noi non abbiamo ceduto alle imposizioni di costoro neppure per un momento , affinché la verità del vangelo rimanesse salda tra di voi .
NR2006	Galati	2	6	Ma quelli che godono di particolare stima ( quello che possono essere stati , a me non importa ; Dio non ha riguardi personali ) , quelli , dico , che godono di maggiore stima non m ’ imposero nulla ;
NR2006	Galati	2	7	anzi , quando videro che a me era stato affidato il vangelo per gli incirconcisi , come a Pietro per i circoncisi
NR2006	Galati	2	8	( perché colui che aveva operato in Pietro per farlo apostolo dei circoncisi aveva anche operato in me per farmi apostolo degli stranieri ) ,
NR2006	Galati	2	9	riconoscendo la grazia che mi era stata accordata , Giacomo , Cefa e Giovanni , che sono reputati colonne , diedero a me e a Barnaba la mano destra in segno di comunione perché andassimo noi agli stranieri , ed essi ai circoncisi ;
NR2006	Galati	2	10	soltanto ci raccomandarono di ricordarci dei poveri , come ho sempre cercato di fare . Pietro ripreso pubblicamente da Paolo in Antiochia
NR2006	Galati	2	11	TR e M Pietro . - Galati
NR2006	Galati	2	12	Infatti , prima che fossero venuti alcuni da parte di Giacomo , egli mangiava con persone non giudaiche ; ma quando quelli furono arrivati , cominciò a ritirarsi e a separarsi per timore dei circoncisi .
NR2006	Galati	2	13	E anche gli altri Giudei si misero a simulare con lui ; a tal punto che perfino Barnaba fu trascinato dalla loro ipocrisia .
NR2006	Galati	2	14	A vivere come i Giudei , cioè a osservare le pratiche religiose della legge . - Galati
NR2006	Galati	2	15	Noi Giudei di nascita , non stranieri peccatori ,
NR2006	Galati	2	16	Nessuno , lett. nessuna carne .
NR2006	Galati	2	17	Ma se nel cercare di essere giustificati in Cristo , siamo anche noi trovati peccatori , vuol dire che Cristo è un servitore del peccato ? No di certo !
NR2006	Galati	2	18	Infatti , se riedifico quello che ho demolito , mi dimostro trasgressore .
NR2006	Galati	2	19	Quanto a me , per mezzo della legge , sono morto alla legge affinché io viva per Dio .
NR2006	Galati	2	20	Sono stato crocifisso con Cristo : non sono più io che vivo , ma Cristo vive in me ! La vita che vivo ora nella carne , la vivo nella fede nel Figlio di Dio il quale mi ha amato e ha dato se stesso per me .
NR2006	Galati	2	21	Io non annullo la grazia di Dio ; perché se la giustizia si ottenesse per mezzo della legge , Cristo sarebbe dunque morto inutilmente . Footnotes - Galati
NR2006	Galati	3	3	:
NR2006	Galati	3	2006	La legge e la fede
NR2006	Galati	3	2	:
NR2006	Galati	3	4	. - Galati
NR2006	Galati	3	5	. - Galati
NR2006	Galati	3	6	. - Galati
NR2006	Galati	3	7	Riconoscete dunque che quanti hanno fede sono figli di Abraamo .
NR2006	Galati	3	8	+ Ge
NR2006	Galati	3	9	In tal modo , coloro che hanno la fede sono benedetti con il credente Abraamo .
NR2006	Galati	3	10	+ De
NR2006	Galati	3	11	+ Ac
NR2006	Galati	3	12	+ Le
NR2006	Galati	3	13	+ De
NR2006	Galati	3	14	affinché la benedizione di Abraamo venisse sugli stranieri in Cristo Gesù , e ricevessimo , per mezzo della fede , lo Spirito promesso . La legge e la promessa
NR2006	Galati	3	15	:
NR2006	Galati	3	16	Le promesse furono fatte ad Abraamo e alla sua progenie . Non dice : « E alle progenie » , come se si trattasse di molte ; ma , come parlando di una sola , dice : « E alla tua progenie » , che è Cristo .
NR2006	Galati	3	17	Ecco quello che voglio dire : un testamento che Dio ha stabilito anteriormente &#91; in Cristo &#93; , non può essere annullato , in modo da render vana la promessa , dalla legge sopraggiunta quattrocentotrent ’ anni più tardi .
NR2006	Galati	3	18	:
NR2006	Galati	3	19	Perché dunque la legge ? Essa fu aggiunta a causa delle trasgressioni , finché venisse la progenie alla quale era stata fatta la promessa ; e fu promulgata per mezzo di angeli , per mano di un mediatore .
NR2006	Galati	3	20	Ora , un mediatore non è mediatore di uno solo ; Dio invece è uno solo .
NR2006	Galati	3	21	:
NR2006	Galati	3	22	ma la Scrittura ha rinchiuso ogni cosa sotto peccato , affinché i beni promessi sulla base della fede in Gesù Cristo fossero dati ai credenti .
NR2006	Galati	3	23	.
NR2006	Galati	3	24	Così la legge è stata come un precettore per condurci a Cristo , affinché noi fossimo giustificati per fede .
NR2006	Galati	3	25	Ma ora che la fede è venuta , non siamo più sotto precettore ;
NR2006	Galati	3	26	. - Galati
NR2006	Galati	3	27	:
NR2006	Galati	3	28	Non c ’ è qui né Giudeo né Greco ; non c ’ è né schiavo né libero ; non c ’ è né maschio né femmina ; perché voi tutti siete uno in Cristo Gesù .
NR2006	Galati	3	29	Se siete di Cristo , siete dunque discendenza di Abraamo , eredi secondo la promessa . Footnotes - Galati
NR2006	Galati	4	4	:
NR2006	Galati	4	2006	Dalla schiavitù della legge alla libertà in Cristo
NR2006	Galati	4	2	ma è sotto tutori e amministratori fino al tempo prestabilito dal padre .
NR2006	Galati	4	3	Così anche noi , quando eravamo bambini , eravamo tenuti in schiavitù dagli elementi del mondo ;
NR2006	Galati	4	5	per riscattare quelli che erano sotto la legge , affinché noi ricevessimo l ’ adozione .
NR2006	Galati	4	6	TR e M vostri . - Galati
NR2006	Galati	4	7	. - Galati
NR2006	Galati	4	8	( B ) In quel tempo , è vero , non avendo conoscenza di Dio , avete servito quelli che per natura non sono dèi ;
NR2006	Galati	4	9	ma ora che avete conosciuto Dio , o piuttosto che siete stati conosciuti da Dio , come mai vi rivolgete di nuovo ai deboli e poveri elementi , di cui volete rendervi schiavi di nuovo ?
NR2006	Galati	4	10	.
NR2006	Galati	4	11	Io temo di essermi affaticato invano per voi .
NR2006	Galati	4	12	Siate come sono io , fratelli , ve ne prego , perché anch ’ io sono come voi .
NR2006	Galati	4	13	Malattia , lett. debolezza della carne . - Galati
NR2006	Galati	4	14	TR e M e la mia prova che era nella mia carne , non … - Galati
NR2006	Galati	4	15	TR e M Cos ’ erano dunque le vostre … - Galati
NR2006	Galati	4	16	Sono dunque diventato vostro nemico dicendovi la verità ?
NR2006	Galati	4	17	Costoro , cioè le persone che turbano i Galati e cercano di distoglierli dal puro vangelo ; cfr .
NR2006	Galati	4	18	Ora è una buona cosa essere in ogni tempo oggetto dello zelo altrui nel bene , e non solo quando sono presente tra di voi .
NR2006	Galati	4	19	TR e M Figlioletti . - Galati
NR2006	Galati	4	20	oh , come vorrei essere ora presente tra di voi e cambiar tono , perché sono perplesso a vostro riguardo !
NR2006	Galati	4	21	:
NR2006	Galati	4	22	Infatti sta scritto che Abraamo ebbe due figli : uno dalla schiava e uno dalla donna libera ;
NR2006	Galati	4	23	ma quello della schiava nacque secondo la carne , mentre quello della libera nacque in virtù della promessa .
NR2006	Galati	4	24	TR i due patti . - Galati
NR2006	Galati	4	25	Alcuni mss. riportano : Infatti il Sinai è un monte nell ’ Arabia … - Galati
NR2006	Galati	4	26	TR e M ed è madre di tutti noi . - Galati
NR2006	Galati	4	27	+ Is
NR2006	Galati	4	28	TR e M noi siamo … - Galati
NR2006	Galati	4	29	E come allora colui che era nato secondo la carne perseguitava quello che era nato secondo lo Spirito , così succede anche ora .
NR2006	Galati	4	30	+ Ge
NR2006	Galati	4	31	Perciò , fratelli , noi non siamo figli della schiava , ma della donna libera . Footnotes - Galati
NR2006	Galati	4	1	. - Galati
NR2006	Galati	4	54	:
NR2006	Galati	5	5	:
NR2006	Galati	5	2006	""
NR2006	Galati	5	2	( A ) Ecco , io , Paolo , vi dichiaro che se vi fate circoncidere , Cristo non vi gioverà a nulla .
NR2006	Galati	5	3	Dichiaro di nuovo : ogni uomo che si fa circoncidere è obbligato a osservare tutta la legge .
NR2006	Galati	5	4	Voi che volete essere giustificati dalla legge siete separati da Cristo ; siete scaduti dalla grazia .
NR2006	Galati	5	6	Infatti , in Cristo Gesù non ha valore né la circoncisione né l ’ incirconcisione ; quello che vale è la fede che opera per mezzo dell ’ amore .
NR2006	Galati	5	7	Voi correvate bene ; chi vi ha fermati perché non ubbidiate alla verità ?
NR2006	Galati	5	8	Una tale persuasione non viene da colui che vi chiama .
NR2006	Galati	5	9	Un po ’ di lievito fa lievitare tutta la pasta .
NR2006	Galati	5	10	Riguardo a voi , io ho questa fiducia nel Signore , che non la penserete diversamente ; ma colui che vi turba ne subirà la condanna , chiunque egli sia .
NR2006	Galati	5	11	Quanto a me , fratelli , se io predico ancora la circoncisione , perché sono ancora perseguitato ? Lo scandalo della croce sarebbe allora tolto via .
NR2006	Galati	5	12	Evirare , lett. mutilare . - Galati
NR2006	Galati	5	13	( B ) Perché , fratelli , voi siete stati chiamati a libertà ; soltanto non fate della libertà un ’ occasione per vivere secondo la carne , ma per mezzo dell ’ amore servite gli uni agli altri ;
NR2006	Galati	5	14	+ Le
NR2006	Galati	5	15	Ma se vi mordete e divorate gli uni gli altri , guardate di non essere consumati gli uni dagli altri .
NR2006	Galati	5	16	( C ) Io dico : camminate secondo lo Spirito e non adempirete affatto i desideri della carne .
NR2006	Galati	5	17	Perché la carne ha desideri contrari allo Spirito e lo Spirito ha desideri contrari alla carne ; sono cose opposte tra di loro , in modo che non potete fare quello che vorreste .
NR2006	Galati	5	18	. - Galati
NR2006	Galati	5	19	:
NR2006	Galati	5	20	TR e M discordie , gelosie … - Galati
NR2006	Galati	5	21	invidie , &#91; omicidi , &#93; ubriachezze , orge e altre simili cose ; circa le quali , come vi ho già detto , vi preavviso : chi fa tali cose non erediterà il regno di Dio .
NR2006	Galati	5	22	Il frutto dello Spirito invece è amore , gioia , pace , pazienza , benevolenza , bontà , fedeltà , mansuetudine , autocontrollo ;
NR2006	Galati	5	23	contro queste cose non c ’ è legge .
NR2006	Galati	5	24	Il nome Gesù compare in NA tra parentesi ; TR e M lo omettono .
NR2006	Galati	5	25	Se viviamo per lo Spirito , camminiamo altresì per lo Spirito .
NR2006	Galati	5	26	Non siamo vanagloriosi , provocandoci e invidiandoci gli uni gli altri . Footnotes - Galati
NR2006	Galati	5	1	TR e M State dunque saldi nella libertà con la quale Cristo ci ha liberati e non … - Galati
NR2006	Galati	6	6	:
NR2006	Galati	6	2006	La vita nuova in Cristo
NR2006	Galati	6	2	Portate i pesi gli uni degli altri e adempirete così la legge di Cristo .
NR2006	Galati	6	3	Infatti se uno pensa di essere qualcosa pur non essendo nulla , inganna se stesso .
NR2006	Galati	6	4	Ciascuno esamini invece l ’ opera propria ; così avrà modo di vantarsi in rapporto a se stesso e non perché si paragona agli altri .
NR2006	Galati	6	5	Ciascuno infatti porterà il proprio fardello .
NR2006	Galati	6	7	Non vi ingannate , non ci si può beffare di Dio ; perché quello che l ’ uomo avrà seminato , quello pure mieterà .
NR2006	Galati	6	8	Perché chi semina per la sua carne , mieterà corruzione dalla carne ; ma chi semina per lo Spirito mieterà dallo Spirito vita eterna .
NR2006	Galati	6	9	Non ci scoraggiamo di fare il bene ; perché , se non ci stanchiamo , mieteremo a suo tempo .
