estilo	livro	capitulo	versiculo	texto
NR2006	Atti	9	30	I fratelli , saputolo , lo condussero a Cesarea e di là lo mandarono a Tarso .
NR2006	Atti	9	31	TR e M riportano questo v. al plurale : le chiese , avevano pace , erano edificate , crescevano … - Atti
NR2006	Atti	9	32	( C ) Avvenne che mentre Pietro andava a far visita a tutti , si recò anche dai santi residenti a Lidda .
NR2006	Atti	9	33	Là trovò un uomo di nome Enea , che da otto anni giaceva paralitico in un letto .
NR2006	Atti	9	34	TR e M Gesù , il Cristo , ti guarisce . - Atti
NR2006	Atti	9	35	E tutti gli abitanti di Lidda e di Saron lo videro e si convertirono al Signore . Tabita risuscitata da Pietro
NR2006	Atti	9	36	( D ) A Ioppe c ’ era una discepola , di nome Tabita , che tradotto vuol dire : « Gazzella » ; ella faceva molte opere buone ed elemosine .
NR2006	Atti	9	37	Proprio in quei giorni si ammalò e morì . E , dopo averla lavata , la deposero in una stanza di sopra .
NR2006	Atti	9	38	TR e M per pregarlo che non esitasse ad andare da loro .
NR2006	Atti	9	39	Pietro allora si alzò e partì con loro . Appena arrivato , lo condussero nella stanza di sopra ; e tutte le vedove si presentarono a lui piangendo , mostrandogli tutte le tuniche e i vestiti che Gazzella faceva mentre era con loro .
NR2006	Atti	9	40	Ma Pietro , fatti uscire tutti , si mise in ginocchio e pregò ; e , voltatosi verso il corpo , disse : « Tabita , àlzati » . Ella aprì gli occhi ; e , visto Pietro , si mise seduta .
NR2006	Atti	9	41	Egli le diede la mano e la fece alzare ; e , chiamati i santi e le vedove , la presentò loro in vita .
NR2006	Atti	9	42	Ciò fu risaputo in tutta Ioppe , e molti credettero nel Signore .
NR2006	Atti	9	43	Pietro rimase molti giorni a Ioppe , presso un certo Simone , conciatore di pelli . Footnotes - Atti
NR2006	Atti	9	1	. - Atti
NR2006	Atti	10	10	:
NR2006	Atti	10	2006	Il vangelo annunciato ai pagani ; Cornelio invita Pietro a casa sua
NR2006	Atti	10	2	Quest ’ uomo era pio e timorato di Dio con tutta la sua famiglia , faceva molte elemosine al popolo e pregava Dio assiduamente .
NR2006	Atti	10	3	L ’ ora nona , cioè le tre pomeridiane . - Atti
NR2006	Atti	10	4	Egli , guardandolo fisso e preso da spavento , rispose : « Che c ’ è , Signore ? » E l ’ angelo gli disse : « Le tue preghiere e le tue elemosine sono salite , come una ricordanza , davanti a Dio .
NR2006	Atti	10	5	TR e M omettono un certo . - Atti
NR2006	Atti	10	6	TR … vicino al mare ; egli ti dirà ciò che devi fare » . - Atti
NR2006	Atti	10	7	TR e M Appena l ’ angelo che parlava a Cornelio se ne fu andato , egli chiamò … - Atti
NR2006	Atti	10	8	e , dopo aver raccontato loro ogni cosa , li mandò a Ioppe .
NR2006	Atti	10	9	L ’ ora sesta , cioè mezzogiorno . - Atti
NR2006	Atti	10	11	TR e M una gran tovaglia , tenuta per i quattro angoli e che veniva calata a terra . - Atti
NR2006	Atti	10	12	TR e M … ogni sorta di quadrupedi della terra , di fiere , di rettili e di uccelli del cielo . - Atti
NR2006	Atti	10	13	E una voce gli disse : « Àlzati , Pietro ; ammazza e mangia » .
NR2006	Atti	10	14	TR e M di impuro o di contaminato . - Atti
NR2006	Atti	10	15	E la voce parlò una seconda volta : « Le cose che Dio ha purificate , non farle tu impure » .
NR2006	Atti	10	16	TR e M poi l ’ oggetto fu di nuovo ritirato in cielo . - Atti
NR2006	Atti	10	17	Mentre Pietro , dentro di sé , si domandava che cosa significasse la visione che aveva avuto , ecco gli uomini mandati da Cornelio , i quali , avendo domandato della casa di Simone , si fermarono alla porta .
NR2006	Atti	10	18	Avendo chiamato , chiesero se Simone , detto anche Pietro , alloggiasse lì .
NR2006	Atti	10	19	Mentre Pietro stava ripensando alla visione , lo Spirito { gli } disse : « Ecco tre uomini che ti cercano .
NR2006	Atti	10	20	Àlzati dunque , scendi e va ’ con loro , senza fartene scrupolo , perché li ho mandati io » .
NR2006	Atti	10	21	TR verso gli uomini che gli erano stati mandati da Cornelio … - Atti
NR2006	Atti	10	22	Essi risposero : « Il centurione Cornelio , uomo giusto e timorato di Dio , del quale rende buona testimonianza tutto il popolo dei Giudei , è stato divinamente avvertito da un santo angelo di farti chiamare in casa sua , e di ascoltare quello che avrai da dirgli » .
NR2006	Atti	10	23	Pietro allora li fece entrare e li ospitò . Il giorno seguente andò con loro , e alcuni fratelli di Ioppe lo accompagnarono .
NR2006	Atti	10	24	L ’ indomani arrivarono a Cesarea . Cornelio li stava aspettando e aveva chiamato i suoi parenti e i suoi amici intimi .
NR2006	Atti	10	25	Mentre Pietro entrava , Cornelio , andandogli incontro , si gettò ai suoi piedi per adorarlo .
NR2006	Atti	10	26	Ma Pietro lo rialzò , dicendo : « Àlzati , anch ’ io sono uomo ! »
NR2006	Atti	10	27	Conversando con lui , entrò e , trovate molte persone lì riunite ,
NR2006	Atti	10	28	Voi sapete … entrare in casa sua . Questa proibizione non è prescritta in modo formale nella legge di Mosè , ma i Giudei la consideravano come una logica conseguenza di essa . - Atti
NR2006	Atti	10	29	Perciò , essendo stato chiamato , sono venuto senza fare obiezioni . Ora vi chiedo : qual è il motivo per cui mi avete mandato a chiamare ? »
NR2006	Atti	10	30	TR e M Quattro giorni or sono , verso quest ’ ora , stavo digiunando e all ’ ora nona , mentre pregavo , mi si presentò davanti un uomo in veste risplendente . - Atti
NR2006	Atti	10	31	e disse : “ Cornelio , la tua preghiera è stata esaudita e le tue elemosine sono state ricordate davanti a Dio .
NR2006	Atti	10	32	Manda dunque qualcuno a Ioppe e fa ’ venire Simone , detto anche Pietro ; egli è ospite in casa di Simone , conciatore di pelli , in riva al mare &#91; ; quando sarà venuto , egli ti parlerà &#93; ” .
NR2006	Atti	10	33	TR e M da Dio . - Atti
NR2006	Atti	10	34	Cominciando a parlare , lett. aperta la bocca . - Atti
NR2006	Atti	10	35	ma che in qualunque nazione chi lo teme e opera giustamente gli è gradito .
NR2006	Atti	10	36	Questa è la parola che egli ha diretta ai figli d ’ Israele , portando il lieto messaggio di pace per mezzo di Gesù Cristo . Egli è il Signore di tutti .
NR2006	Atti	10	37	Voi sapete quello che è avvenuto in tutta la Giudea , incominciando dalla Galilea , dopo il battesimo predicato da Giovanni ,
NR2006	Atti	10	38	vale a dire , la storia di Gesù di Nazaret : come Dio lo ha unto di Spirito Santo e di potenza , e come egli è andato dappertutto facendo del bene e guarendo tutti quelli che erano sotto il potere del diavolo , perché Dio era con lui .
NR2006	Atti	10	39	E noi siamo testimoni di tutte le cose da lui compiute nel paese dei Giudei e in Gerusalemme ; essi lo uccisero , appendendolo a un legno .
NR2006	Atti	10	40	Ma Dio lo ha risuscitato il terzo giorno e volle che egli si manifestasse
NR2006	Atti	10	41	non a tutto il popolo , ma ai testimoni prescelti da Dio ; cioè a noi , che abbiamo mangiato e bevuto con lui dopo la sua risurrezione dai morti .
NR2006	Atti	10	42	E ci ha comandato di annunciare al popolo e di testimoniare che egli è colui che è stato da Dio costituito giudice dei vivi e dei morti .
NR2006	Atti	10	43	Di lui attestano tutti i profeti che chiunque crede in lui riceve il perdono dei peccati mediante il suo nome » .
NR2006	Atti	10	44	Mentre Pietro parlava così , lo Spirito Santo scese su tutti quelli che ascoltavano la Parola .
NR2006	Atti	10	45	Agli stranieri , lett. ai Gentili . - Atti
NR2006	Atti	10	46	perché li udivano parlare in altre lingue e glorificare Dio .
NR2006	Atti	10	47	Allora Pietro disse : « C ’ è forse qualcuno che possa negare l ’ acqua e impedire che siano battezzati questi che hanno ricevuto lo Spirito Santo come noi ? »
NR2006	Atti	10	48	TR e M nel nome del Signore .
NR2006	Atti	11	11	:
NR2006	Atti	11	2006	Pietro si giustifica per aver fatto battezzare Cornelio
NR2006	Atti	11	2	.
NR2006	Atti	11	3	dicendo : « Tu sei entrato in casa di uomini non circoncisi e hai mangiato con loro ! »
NR2006	Atti	11	4	Allora Pietro raccontò loro le cose per ordine fin dal principio , dicendo :
NR2006	Atti	11	5	« Io ero nella città di Ioppe in preghiera e , rapito in estasi , ebbi una visione : un oggetto che scendeva , simile a una grande tovaglia calata dal cielo per i quattro angoli , e giunse fino a me ;
NR2006	Atti	11	6	io , fissandolo con attenzione , lo esaminai e vidi quadrupedi della terra , fiere , rettili e uccelli del cielo .
NR2006	Atti	11	7	TR e M omettono anche . - Atti
NR2006	Atti	11	8	Ma io dissi : “ Assolutamente no , Signore , perché nulla di impuro o contaminato è mai entrato nella mia bocca ” .
NR2006	Atti	11	9	Ma la voce &#91; mi &#93; rispose per la seconda volta dal cielo : “ Le cose che Dio ha purificate , non farle tu impure ” .
NR2006	Atti	11	10	E ciò accadde per tre volte , poi ogni cosa fu di nuovo ritirata in cielo .
NR2006	Atti	11	12	Lo Spirito mi disse di andare con loro , senza farmene scrupolo . Anche questi sei fratelli vennero con me , ed entrammo in casa di quell ’ uomo .
NR2006	Atti	11	13	TR e M manda degli uomini … - Atti
NR2006	Atti	11	14	Egli ti parlerà di cose per le quali sarai salvato tu e tutta la tua famiglia ” .
NR2006	Atti	11	15	Avevo appena cominciato a parlare quando lo Spirito Santo scese su di loro , esattamente come su di noi al principio .
NR2006	Atti	11	16	Mi ricordai allora di quella parola del Signore che diceva : “ Giovanni ha battezzato con acqua , ma voi sarete battezzati con lo Spirito Santo ” .
NR2006	Atti	11	17	Se dunque Dio ha dato a loro lo stesso dono che ha dato anche a noi che abbiamo creduto nel Signore Gesù Cristo , chi ero io da potermi opporre a Dio ? »
NR2006	Atti	11	18	:
NR2006	Atti	11	19	( B ) Quelli che erano stati dispersi per la persecuzione avvenuta a causa di Stefano , andarono sino in Fenicia , a Cipro e ad Antiochia , annunciando la Parola solo ai Giudei , e a nessun altro .
NR2006	Atti	11	20	TR e M omettono anche . - Atti
NR2006	Atti	11	21	La mano del Signore era con loro ; e grande fu il numero di coloro che credettero e si convertirono al Signore .
NR2006	Atti	11	22	La notizia giunse alle orecchie della chiesa che era in Gerusalemme , la quale mandò Barnaba fino ad Antiochia .
NR2006	Atti	11	23	Quand ’ egli giunse e vide la grazia di Dio , si rallegrò e li esortò tutti ad attenersi al Signore con cuore risoluto ,
NR2006	Atti	11	24	perché egli era un uomo buono , pieno di Spirito Santo e di fede . E una folla molto numerosa fu aggiunta al Signore .
NR2006	Atti	11	25	Poi &#91; Barnaba &#93; partì verso Tarso , a cercare Saulo ; e , dopo averlo trovato , lo condusse ad Antiochia .
NR2006	Atti	11	26	Essi parteciparono per un anno intero alle riunioni della chiesa e istruirono un gran numero di persone ; ad Antiochia , per la prima volta , i discepoli furono chiamati cristiani . La chiesa di Antiochia manda dei doni ai cristiani di Gerusalemme
NR2006	Atti	11	27	( C ) In quei giorni , alcuni profeti scesero da Gerusalemme ad Antiochia .
NR2006	Atti	11	28	Claudio , uno degli imperatori romani ; vd . At
NR2006	Atti	11	29	I discepoli decisero allora di inviare una sovvenzione , ciascuno secondo le proprie possibilità , ai fratelli che abitavano in Giudea .
NR2006	Atti	11	30	E così fecero , inviandola agli anziani , per mezzo di Barnaba e di Saulo . Footnotes - Atti
NR2006	Atti	12	12	:
NR2006	Atti	12	2006	Erode Agrippa fa uccidere Giacomo ; Pietro liberato dal carcere
NR2006	Atti	12	2	e fece uccidere di spada Giacomo , fratello di Giovanni .
NR2006	Atti	12	3	Vedendo che ciò era gradito ai Giudei , continuò e fece arrestare anche Pietro . Erano i giorni degli Azzimi .
NR2006	Atti	12	4	Dopo averlo fatto arrestare , lo mise in prigione , affidandolo alla custodia di quattro picchetti di quattro soldati ciascuno ; perché voleva farlo comparire davanti al popolo dopo la Pasqua .
NR2006	Atti	12	5	Così TR e M ; NA ma preghiere a Dio erano costantemente fatte per lui … - Atti
NR2006	Atti	12	6	Nella notte che precedeva il giorno in cui Erode voleva farlo comparire , Pietro stava dormendo in mezzo a due soldati , legato con due catene ; e le sentinelle davanti alla porta custodivano il carcere .
NR2006	Atti	12	7	Ed ecco , un angelo del Signore sopraggiunse e una luce risplendette nella cella . L ’ angelo , battendo il fianco a Pietro , lo svegliò , dicendo : « Àlzati , presto ! » E le catene gli caddero dalle mani .
NR2006	Atti	12	8	Vèstiti , lett. cingiti . - Atti
NR2006	Atti	12	9	Ed egli , uscito , lo seguiva , non sapendo che era realtà ciò che stava succedendo per opera dell ’ angelo : credeva infatti di avere una visione .
NR2006	Atti	12	10	Com ’ ebbero oltrepassata la prima e la seconda guardia , giunsero alla porta di ferro che immette in città , la quale si aprì da sé davanti a loro ; uscirono e s ’ inoltrarono per una strada ; e , all ’ improvviso , l ’ angelo si allontanò da lui .
NR2006	Atti	12	11	Pietro , rientrato in sé , disse : « Ora so di sicuro che il Signore ha mandato il suo angelo e mi ha liberato dalla mano di Erode e da tutto ciò che si attendeva il popolo dei Giudei » .
NR2006	Atti	12	13	Quando &#91; Pietro &#93; ebbe bussato alla porta d ’ ingresso , una serva di nome Rode si avvicinò per sentire chi era
NR2006	Atti	12	14	e , riconosciuta la voce di Pietro , per la gioia non aprì la porta , ma corse dentro ad annunciare che Pietro stava davanti alla porta .
NR2006	Atti	12	15	Quelli le dissero : « Tu sei pazza ! » Ma ella insisteva che la cosa stava così . Ed essi dicevano : « È il suo angelo » .
NR2006	Atti	12	16	Pietro intanto continuava a bussare e , quand ’ ebbero aperto , lo videro e rimasero stupiti .
NR2006	Atti	12	17	Ma egli , con la mano , fece { loro } cenno di tacere e raccontò in che modo il Signore lo aveva fatto uscire dal carcere . Poi disse : « Fate sapere queste cose a Giacomo e ai fratelli » . Quindi uscì e se ne andò in un altro luogo .
NR2006	Atti	12	18	Fattosi giorno , i soldati furono molto agitati , perché non sapevano che cosa fosse avvenuto di Pietro .
NR2006	Atti	12	19	Erode lo fece cercare e , non avendolo trovato , processò le guardie e comandò che fossero condotte al supplizio . Poi scese dalla Giudea e soggiornò a Cesarea . Erode colpito dal castigo di Dio
NR2006	Atti	12	20	Così TR e M ; NA Egli … - Atti
NR2006	Atti	12	21	Trono , lett. tribuna , forse quella del teatro in cui si celebravano i giochi in onore dell ’ imperatore . - Atti
NR2006	Atti	12	22	E il popolo acclamava : « Voce di un dio e non di un uomo ! »
NR2006	Atti	12	23	In quell ’ istante un angelo del Signore lo colpì , perché non aveva dato la gloria a Dio ; e , roso dai vermi , morì .
NR2006	Atti	12	24	Intanto la Parola di Dio progrediva e si diffondeva sempre di più .
NR2006	Atti	12	25	Così TR ; M e NA a Gerusalemme .
NR2006	Atti	13	13	:
NR2006	Atti	13	2006	Primo viaggio missionario Barnaba e Saulo scelti dallo Spirito Santo
NR2006	Atti	13	2	:
NR2006	Atti	13	3	. - Atti
NR2006	Atti	13	4	Seleucia , porto di Antiochia . - Atti
NR2006	Atti	13	5	. - Atti
NR2006	Atti	13	6	. - Atti
NR2006	Atti	13	7	. - Atti
NR2006	Atti	13	8	Ma Elima , il mago ( questo è il significato del suo nome ) , faceva loro opposizione cercando di distogliere il proconsole dalla fede .
NR2006	Atti	13	9	Paolo , nome che ormai comparirà nel N.T. in sostituzione di quello di Saulo . - Atti
NR2006	Atti	13	10	. - Atti
NR2006	Atti	13	11	Ecco , ora la mano del Signore è su di te , e sarai cieco per un certo tempo , senza vedere il sole » . In quell ’ istante , oscurità e tenebre piombarono su di lui ; e andando qua e là cercava chi lo conducesse per la mano .
NR2006	Atti	13	12	Allora il proconsole , visto quello che era accaduto , credette , colpito dalla dottrina del Signore .
NR2006	Atti	13	14	. - Atti
NR2006	Atti	13	15	Fratelli , lett. uomini fratelli . - Atti
NR2006	Atti	13	16	:
NR2006	Atti	13	17	M omette d ’ Israele . - Atti
NR2006	Atti	13	18	Sopportò la loro condotta nel deserto , altri leggono : li nutrì nel deserto . - Atti
NR2006	Atti	13	19	Poi , dopo aver distrutto sette nazioni nel paese di Canaan , distribuì &#91; loro &#93; come eredità il paese di quelle .
NR2006	Atti	13	20	Tutto questo per circa
NR2006	Atti	13	21	In seguito chiesero un re ; e Dio diede loro Saul , figlio di Chis , della tribù di Beniamino , per un periodo di quarant ’ anni .
NR2006	Atti	13	22	+
NR2006	Atti	13	23	M a Israele una salvezza . - Atti
NR2006	Atti	13	24	Giovanni , prima della venuta di lui , aveva predicato il battesimo del ravvedimento a tutto il popolo d ’ Israele .
NR2006	Atti	13	25	Calzari , lett. calzari dei piedi . - Atti
NR2006	Atti	13	26	TR e M a voi . - Atti
NR2006	Atti	13	27	Infatti gli abitanti di Gerusalemme e i loro capi non hanno riconosciuto questo Gesù e , condannandolo , adempirono le dichiarazioni dei profeti che si leggono ogni sabato .
NR2006	Atti	13	28	Benché non trovassero in lui nulla che fosse degno di morte , chiesero a Pilato che fosse ucciso .
NR2006	Atti	13	29	Dopo aver compiuto tutte le cose che erano scritte di lui , lo trassero giù dal legno e lo deposero in un sepolcro .
NR2006	Atti	13	30	Ma Dio lo risuscitò dai morti ;
NR2006	Atti	13	31	Il termine ora compare in NA tra parentesi ; TR e M lo omettono . - Atti
NR2006	Atti	13	32	E noi vi portiamo il lieto messaggio che la promessa fatta ai padri
NR2006	Atti	13	33	+ Sl
NR2006	Atti	13	34	+ Is
NR2006	Atti	13	35	+ Sl
NR2006	Atti	13	36	E il suo corpo si è decomposto , lett. e ha visto la decomposizione . - Atti
NR2006	Atti	13	37	Subìto , lett. visto . - Atti
NR2006	Atti	13	38	Fratelli , lett. uomini fratelli . - Atti
NR2006	Atti	13	39	e , per mezzo di lui , chiunque crede è giustificato di tutte le cose , delle quali voi non avete potuto essere giustificati mediante la legge di Mosè .
NR2006	Atti	13	40	Guardate dunque che non vi accada ciò che è detto nei profeti :
NR2006	Atti	13	41	+ Ac
NR2006	Atti	13	42	TR e M Quando i Giudei furono usciti dalla sinagoga ( oppure quando uscirono dalla sinagoga dei Giudei ) , i Gentili li pregarono … - Atti
NR2006	Atti	13	43	Dopo che la riunione si fu sciolta , molti Giudei e proseliti pii seguirono Paolo e Barnaba ; i quali , parlando loro , li convincevano a perseverare nella grazia di Dio .
NR2006	Atti	13	44	TR e M Parola di Dio . - Atti
NR2006	Atti	13	45	Ma i Giudei , vedendo la folla , furono pieni di invidia e , &#91; opponendosi e &#93; bestemmiando , contraddicevano le cose dette da Paolo .
NR2006	Atti	13	46	Ma Paolo e Barnaba dissero con franchezza : « Era necessario che a voi per primi si annunciasse la Parola di Dio ; ma poiché la respingete e non vi ritenete degni della vita eterna , ecco , ci rivolgiamo agli stranieri .
NR2006	Atti	13	47	+ Is
NR2006	Atti	13	48	Gli stranieri , udendo queste cose , si rallegravano e glorificavano la Parola del Signore ; e tutti quelli che erano ordinati a vita eterna , credettero .
NR2006	Atti	13	49	:
NR2006	Atti	13	50	Ma i Giudei istigarono le donne pie e ragguardevoli e i notabili della città , scatenarono una persecuzione contro Paolo e Barnaba e li cacciarono fuori dal loro territorio .
NR2006	Atti	13	51	Iconio , città della Licaonia a est della Pisidia , come anche Listra e Derba menzionate più avanti .
NR2006	Atti	13	52	mentre i discepoli erano pieni di gioia e di Spirito Santo . Footnotes - Atti
NR2006	Atti	13	450	anni , diede loro dei giudici … - Atti
NR2006	Atti	13	1	:
NR2006	Atti	13	55	:
NR2006	Atti	14	14	:
NR2006	Atti	14	2006	Paolo e Barnaba a Iconio
NR2006	Atti	14	2	Ma i Giudei che avevano rifiutato di credere aizzarono e inasprirono gli animi dei pagani contro i fratelli .
NR2006	Atti	14	3	Tuttavia rimasero là per molto tempo , predicando con franchezza e confidando nel Signore che rendeva testimonianza alla Parola della sua grazia e concedeva che per mano loro avvenissero segni e prodigi .
NR2006	Atti	14	4	Ma la popolazione della città era divisa : gli uni tenevano per i Giudei , e gli altri per gli apostoli .
NR2006	Atti	14	5	Ma quando ci fu un tentativo dei pagani e dei Giudei , d ’ accordo con i loro capi , di oltraggiare gli apostoli e lapidarli ,
NR2006	Atti	14	6	questi lo seppero e fuggirono nelle città di Licaonia , Listra e Derba e nei dintorni ;
NR2006	Atti	14	7	e là continuarono a evangelizzare . Il vangelo predicato a Listra
NR2006	Atti	14	8	Dalla nascita , lett. dal grembo di sua madre . - Atti
NR2006	Atti	14	9	Egli udì parlare Paolo , il quale , fissati gli occhi su di lui e vedendo che aveva fede per essere guarito ,
NR2006	Atti	14	10	disse ad alta voce : « Àlzati in piedi » . Ed egli saltò su e si mise a camminare .
NR2006	Atti	14	11	La folla , veduto ciò che Paolo aveva fatto , alzò la voce , dicendo in lingua licaonica : « Gli dèi hanno preso forma umana e sono scesi fino a noi » .
NR2006	Atti	14	12	E chiamavano Barnaba , Giove e Paolo , Mercurio , perché era lui che teneva il discorso .
NR2006	Atti	14	13	Il sacerdote di Giove , il cui tempio era all ’ entrata della &#91; loro &#93; città , condusse davanti alle porte tori e ghirlande e voleva offrire un sacrificio con la folla .
NR2006	Atti	14	15	« Uomini , perché fate queste cose ? Anche noi siamo esseri umani come voi ; e vi predichiamo che da queste vanità vi convertiate al Dio vivente , che ha fatto il cielo , la terra , il mare e tutte le cose che sono in essi .
NR2006	Atti	14	16	Egli , nelle generazioni passate , ha lasciato che ogni popolo seguisse la propria via ,
NR2006	Atti	14	17	TR e M i nostri cuori . - Atti
NR2006	Atti	14	18	E con queste parole riuscirono a stento a impedire che la folla offrisse loro un sacrificio . Lapidazione di Paolo a Listra
NR2006	Atti	14	19	( C ) Allora giunsero da Antiochia e da Iconio alcuni Giudei , i quali sobillarono la folla ; essi lapidarono Paolo e lo trascinarono fuori dalla città , credendolo morto .
NR2006	Atti	14	20	Ma mentre i discepoli venivano attorno a lui , egli si rialzò ed entrò nella città . Evangelizzazione a Derba e ritorno ad Antiochia ( D ) Il giorno seguente partì con Barnaba per Derba .
NR2006	Atti	14	21	E , dopo aver evangelizzato quella città e fatto molti discepoli , se ne tornarono a Listra , a Iconio e ad Antiochia ,
NR2006	Atti	14	22	fortificando gli animi dei discepoli ed esortandoli a perseverare nella fede , dicendo loro che dobbiamo entrare nel regno di Dio attraverso molte tribolazioni .
NR2006	Atti	14	23	Altri traducono : E fatti eleggere per ciascuna chiesa degli anziani … - Atti
NR2006	Atti	14	24	Quindi , attraversata la Pisidia , giunsero in Panfilia .
NR2006	Atti	14	25	Attalia , città sulla costa della Panfilia .
NR2006	Atti	14	26	e di là salparono verso Antiochia , da dove erano stati raccomandati alla grazia di Dio per l ’ opera che avevano compiuta .
NR2006	Atti	14	27	Giunti là e riunita la chiesa , riferirono tutte le cose che Dio aveva compiute per mezzo di loro e come aveva aperto la porta della fede agli stranieri .
NR2006	Atti	14	28	E rimasero &#91; lì &#93; con i discepoli parecchio tempo . Footnotes - Atti
NR2006	Atti	14	1	Greci , cioè pagani , uomini che non appartenevano al popolo d ’ Israele . - Atti
NR2006	Atti	15	15	:
NR2006	Atti	15	2006	La conferenza di Gerusalemme
NR2006	Atti	15	2	E siccome Paolo e Barnaba dissentivano e discutevano vivacemente con loro , fu deciso che Paolo , Barnaba e alcuni altri fratelli salissero a Gerusalemme dagli apostoli e anziani per trattare la questione .
NR2006	Atti	15	3	Essi dunque , accompagnati per un tratto dalla chiesa , attraversarono la Fenicia e la Samaria , raccontando la conversione degli stranieri e suscitando grande gioia in tutti i fratelli .
NR2006	Atti	15	4	Poi , giunti a Gerusalemme , furono accolti dalla chiesa , dagli apostoli e dagli anziani e riferirono le grandi cose che Dio aveva fatte per mezzo di loro .
NR2006	Atti	15	5	Ma alcuni della setta dei farisei , che erano diventati credenti , si alzarono dicendo : « Bisogna circonciderli e comandare loro di osservare la legge di Mosè » .
NR2006	Atti	15	6	Allora gli apostoli e gli anziani si riunirono per esaminare la questione .
NR2006	Atti	15	7	Fratelli , lett. uomini fratelli . - Atti
NR2006	Atti	15	8	E Dio , che conosce i cuori , rese testimonianza in loro favore , dando lo Spirito Santo a loro , come a noi ;
NR2006	Atti	15	9	: 11-12 ; Is
NR2006	Atti	15	10	Or dunque perché tentate Dio mettendo sul collo dei discepoli un giogo che né i padri nostri né noi siamo stati in grado di portare ?
NR2006	Atti	15	11	TR del Signore Gesù Cristo . - Atti
NR2006	Atti	15	12	Tutta l ’ assemblea tacque e stava ad ascoltare Barnaba e Paolo , che raccontavano quali segni e prodigi Dio aveva fatti per mezzo di loro tra i pagani .
NR2006	Atti	15	13	( B ) Quando ebbero finito di parlare , Giacomo prese la parola e disse :
NR2006	Atti	15	14	Un popolo consacrato al suo nome , lett. un popolo per il suo nome . - Atti
NR2006	Atti	15	16	“ Dopo queste cose ritornerò e ricostruirò la tenda di Davide , che è caduta ; e restaurerò le sue rovine e la rimetterò in piedi ,
NR2006	Atti	15	17	affinché il rimanente degli uomini e tutte le nazioni , su cui è invocato il mio nome , cerchino il Signore , dice il Signore che fa &#91; tutte &#93; queste cose ,
NR2006	Atti	15	18	+ Am
NR2006	Atti	15	19	Gli stranieri , lett. quelli delle nazioni . - Atti
NR2006	Atti	15	20	ma che si scriva loro di astenersi dalle cose contaminate nei sacrifici agli idoli , dalla fornicazione , dagli animali soffocati e dal sangue .
NR2006	Atti	15	21	; TR e M A Dio tutte le sue opere sono note fin dall ’ eternità . - Atti
NR2006	Atti	15	22	TR Barsaba . - Atti
NR2006	Atti	15	23	TR e M Gli apostoli , gli anziani e i fratelli , ai … - Atti
NR2006	Atti	15	24	Abbiamo saputo che alcuni fra noi , partiti senza nessun mandato da parte nostra , vi hanno turbato con i loro discorsi , sconvolgendo le anime vostre &#91; dicendo che bisogna che siate circoncisi e osserviate la legge &#93; .
