estilo	livro	capitulo	versiculo	texto
NR2006	Luca	7	43	Simone rispose : « Ritengo sia colui al quale ha condonato di più » . Gesù gli disse : « Hai giudicato rettamente » .
NR2006	Luca	7	44	TR e M coi capelli del suo capo . - Luca
NR2006	Luca	7	45	Tu non mi hai dato un bacio ; ma lei , da quando sono entrato , non ha smesso di baciarmi i piedi .
NR2006	Luca	7	46	Tu non mi hai versato l ’ olio sul capo ; ma lei mi ha cosparso di olio profumato i piedi .
NR2006	Luca	7	47	Le sono perdonati , perché ha molto amato , altra possibile traduzione : le sono perdonati ; perciò ha molto amato .
NR2006	Luca	7	48	Poi disse a lei : « I tuoi peccati sono perdonati » .
NR2006	Luca	7	49	Quelli che erano a tavola con lui cominciarono a dire in loro stessi : « Chi è costui che perdona anche i peccati ? »
NR2006	Luca	7	50	Ma egli disse alla donna : « La tua fede ti ha salvata ; va ’ in pace » . Footnotes - Luca
NR2006	Luca	7	1	. - Luca
NR2006	Luca	8	8	:
NR2006	Luca	8	2006	Le donne che accompagnavano Gesù
NR2006	Luca	8	2	Con lui vi erano i dodici e alcune donne che erano state guarite da spiriti maligni e da malattie : Maria , detta Maddalena , dalla quale erano usciti sette demòni ;
NR2006	Luca	8	3	TR e M lo assistevano . - Luca
NR2006	Luca	8	4	( B ) Or come si riuniva una gran folla e la gente di ogni città accorreva a lui , egli disse in parabola :
NR2006	Luca	8	5	« Il seminatore uscì a seminare la sua semenza ; e , mentre seminava , una parte del seme cadde lungo la strada : fu calpestato e gli uccelli del cielo lo mangiarono .
NR2006	Luca	8	6	: 9-10 . - Luca
NR2006	Luca	8	7	Un ’ altra cadde in mezzo alle spine : le spine , crescendo insieme ad esso , lo soffocarono .
NR2006	Luca	8	9	TR e M gli domandarono , dicendo : Cosa vuol dire questa parabola ? - Luca
NR2006	Luca	8	10	+ Is
NR2006	Luca	8	11	Or questo è il significato della parabola : il seme è la parola di Dio .
NR2006	Luca	8	12	Quelli lungo la strada sono coloro che ascoltano , ma poi viene il diavolo e porta via la parola dal loro cuore , affinché non credano e non siano salvati .
NR2006	Luca	8	13	Quelli sulla roccia sono coloro i quali , quando ascoltano la parola , la ricevono con gioia ; ma costoro non hanno radice , credono per un certo tempo ma , quando viene la prova , si tirano indietro .
NR2006	Luca	8	14	Quello che è caduto tra le spine sono coloro che ascoltano , ma se ne vanno e restano soffocati dalle preoccupazioni , dalle ricchezze e dai piaceri della vita , e non arrivano a maturità .
NR2006	Luca	8	15	E quello che è caduto in un buon terreno sono coloro i quali , dopo aver udito la parola , la ritengono in un cuore onesto e buono e portano frutto con perseveranza . La lampada sul candeliere
NR2006	Luca	8	16	( C ) « Nessuno , accesa una lampada , la copre con un vaso o la mette sotto il letto ; anzi la mette sul candeliere , perché chi entra veda la luce .
NR2006	Luca	8	17	Poiché non c ’ è nulla di nascosto che non debba manifestarsi , né di segreto che non debba essere conosciuto e venire alla luce .
NR2006	Luca	8	18	Attenti dunque a come ascoltate : perché a chi ha , sarà dato , ma a chi non ha , anche quello che pensa di avere gli sarà tolto » . La madre e i fratelli di Gesù
NR2006	Luca	8	19	( D ) Sua madre e i suoi fratelli vennero a trovarlo , ma non potevano avvicinarlo a motivo della folla .
NR2006	Luca	8	20	Gli fu riferito : « Tua madre e i tuoi fratelli sono là fuori e vogliono vederti » .
NR2006	Luca	8	21	Ma egli rispose loro : « Mia madre e i miei fratelli sono quelli che ascoltano la parola di Dio e la mettono in pratica » . Gesù calma la tempesta
NR2006	Luca	8	22	( E ) Un giorno egli salì su una barca con i suoi discepoli e disse loro : « Passiamo all ’ altra riva del lago » . E presero il largo .
NR2006	Luca	8	23	Mentre navigavano , egli si addormentò ; e si abbatté sul lago un turbine di vento , tanto che la barca si riempiva d ’ acqua , ed essi erano in pericolo .
NR2006	Luca	8	24	Essi , avvicinatisi , lo svegliarono , dicendo : « Maestro , Maestro , noi periamo ! » Ma egli , destatosi , sgridò il vento e i flutti , che si calmarono , e si fece bonaccia .
NR2006	Luca	8	25	Poi disse loro : « Dov ’ è la vostra fede ? » Ma essi , impauriti e meravigliati , dicevano l ’ uno all ’ altro : « Chi è mai costui che comanda anche ai venti e all ’ acqua , e gli ubbidiscono ? » Gesù guarisce l ’ indemoniato di Gerasa
NR2006	Luca	8	26	TR e M qui e al v.
NR2006	Luca	8	27	TR e M da molto tempo era posseduto da demòni e non indossava … - Luca
NR2006	Luca	8	28	Appena vide Gesù , lanciò un grido , gli si gettò ai piedi e disse a gran voce : « Che c ’ è fra me e te , Gesù , Figlio del Dio Altissimo ? Ti prego , non tormentarmi » .
NR2006	Luca	8	29	Gesù , infatti , aveva comandato allo spirito immondo di uscire da quell ’ uomo , di cui si era impadronito da molto tempo ; e , anche quando lo legavano con catene e lo custodivano in ceppi , spezzava i legami e veniva trascinato via dal demonio nei deserti .
NR2006	Luca	8	30	Gesù gli domandò &#91; , dicendo &#93; : « Qual è il tuo nome ? » Ed egli rispose : « Legione » ; perché molti demòni erano entrati in lui .
NR2006	Luca	8	31	Ed essi lo pregavano che non comandasse loro di andare nell ’ abisso .
NR2006	Luca	8	32	C ’ era là un branco numeroso di porci che pascolava sul monte ; e i demòni lo pregarono di permettere loro di entrare in quelli . Ed egli lo permise .
NR2006	Luca	8	33	I demòni , usciti da quell ’ uomo , entrarono nei porci ; e quel branco si gettò a precipizio giù nel lago e affogò .
NR2006	Luca	8	34	TR e M e andarono a portare la notizia … - Luca
NR2006	Luca	8	35	La gente uscì a vedere l ’ accaduto ; e , venuta da Gesù , trovò l ’ uomo dal quale erano usciti i demòni che sedeva ai piedi di Gesù , vestito e sano di mente ; e si impaurì .
NR2006	Luca	8	36	Quelli che avevano visto raccontarono loro come l ’ indemoniato era stato liberato .
NR2006	Luca	8	37	TR e M sulla barca . - Luca
NR2006	Luca	8	38	TR e M ma Gesù ... - Luca
NR2006	Luca	8	39	« Torna a casa tua e racconta le grandi cose che Dio ha fatte per te » . Ed egli se ne andò per tutta la città , proclamando le grandi cose che Gesù aveva fatto per lui . Gesù guarisce una donna e risuscita la figlia di Iairo
NR2006	Luca	8	40	TR e M Or avvenne che , al suo ritorno … - Luca
NR2006	Luca	8	41	Ecco venire un uomo di nome Iairo , che era capo della sinagoga ; e , gettatosi ai piedi di Gesù , lo pregava di entrare in casa sua ,
NR2006	Luca	8	42	perché aveva una figlia unica , di circa dodici anni , che stava per morire . Or mentre Gesù vi andava , la folla faceva ressa intorno a lui .
NR2006	Luca	8	43	Una donna , che aveva perdite di sangue da dodici anni { e aveva speso tutti i suoi beni con i medici } senza poter essere guarita da nessuno ,
NR2006	Luca	8	44	si avvicinò di dietro e gli toccò il lembo della veste ; e in quell ’ istante il suo flusso di sangue cessò .
NR2006	Luca	8	45	Cosi TR e M ; NA e siccome tutti negavano , Pietro disse : … - Luca
NR2006	Luca	8	46	Ma Gesù replicò : « Qualcuno mi ha toccato , perché ho sentito che una potenza è uscita da me » .
NR2006	Luca	8	47	La donna , vedendo che non era rimasta inosservata , venne tutta tremante e , gettatasi ai suoi piedi , &#91; gli &#93; dichiarò , in presenza di tutto il popolo , per quale motivo lo aveva toccato e come era stata guarita in un istante .
NR2006	Luca	8	48	Ma egli le disse : « Figliola , &#91; coraggio , &#93; la tua fede ti ha salvata ; va ’ in pace » .
NR2006	Luca	8	49	TR e M dicendogli . - Luca
NR2006	Luca	8	50	Rispose a Iairo , lett. gli rispose . - Luca
NR2006	Luca	8	51	TR e M omettono con lui . - Luca
NR2006	Luca	8	52	TR e M Non piangete ; non è morta , ma dorme .
NR2006	Luca	8	53	E ridevano di lui , sapendo che era morta .
NR2006	Luca	8	54	Ma egli , &#91; dopo aver messo tutti fuori , &#93; prendendole la mano , disse ad alta voce : « Bambina , àlzati » .
NR2006	Luca	8	55	Lo spirito di lei ritornò ed ella si alzò subito ; Gesù comandò che le fosse dato da mangiare .
NR2006	Luca	8	56	E i genitori di lei rimasero sbalorditi ; ma egli ordinò loro di non dire a nessuno quello che era avvenuto . Footnotes - Luca
NR2006	Luca	9	9	:
NR2006	Luca	9	2006	La missione dei dodici apostoli
NR2006	Luca	9	2	R
NR2006	Luca	9	3	Non abbiate tunica di ricambio , lett. non abbiate due tuniche { ciascuno } . - Luca
NR2006	Luca	9	4	:
NR2006	Luca	9	5	Quanto a quelli che non vi riceveranno , uscendo da quella città , scuotete &#91; persino &#93; la polvere dai vostri piedi , in testimonianza contro di loro » .
NR2006	Luca	9	6	Ed essi , partiti , andavano di villaggio in villaggio , evangelizzando e operando guarigioni dappertutto . Perplessità di Erode
NR2006	Luca	9	7	TR e M udì parlare di tutte le cose compiute da lui . - Luca
NR2006	Luca	9	8	altri dicevano : « È apparso Elia » e altri : « È risuscitato uno degli antichi profeti » .
NR2006	Luca	9	10	( C ) Gli apostoli ritornarono e raccontarono a Gesù tutte le cose che avevano fatte ; ed egli li prese con sé e si ritirò in disparte verso &#91; un luogo deserto di &#93; una città chiamata Betsàida .
NR2006	Luca	9	11	Ma le folle , avendolo saputo , lo seguirono ; ed egli li accolse e parlava loro del regno di Dio , e guariva quelli che avevano bisogno di guarigione .
NR2006	Luca	9	12	. - Luca
NR2006	Luca	9	13	Ma egli disse loro : « Date loro voi da mangiare » . Ed essi obiettarono : « Noi non abbiamo altro che cinque pani e due pesci ; a meno che non andiamo noi a comprar dei viveri per tutta questa gente » .
NR2006	Luca	9	14	Perché c ’ erano circa cinquemila uomini . Ed egli disse ai suoi discepoli : « Fateli sedere a gruppi di una cinquantina » .
NR2006	Luca	9	15	E così li fecero accomodare tutti .
NR2006	Luca	9	16	Poi Gesù prese i cinque pani e i due pesci , alzò lo sguardo al cielo e li benedisse , li spezzò e li diede ai suoi discepoli perché li distribuissero alla gente .
NR2006	Luca	9	17	Tutti mangiarono e furono saziati , e dei pezzi avanzati si portarono via dodici ceste . Pietro riconosce in Gesù il Cristo
NR2006	Luca	9	18	( D ) Mentre egli stava pregando in disparte , i discepoli erano con lui ; ed egli domandò loro : « Chi dice la gente che io sia ? »
NR2006	Luca	9	19	E quelli risposero : « Alcuni dicono Giovanni il battista ; altri , Elia , e altri , uno dei profeti antichi che è risuscitato » .
NR2006	Luca	9	20	Ed egli disse loro : « E voi , chi dite che io sia ? » Pietro rispose : « Il Cristo di Dio » .
NR2006	Luca	9	21	Ed egli ordinò loro di non dirlo a nessuno , e aggiunse :
NR2006	Luca	9	22	« Bisogna che il Figlio dell ’ uomo soffra molte cose e sia respinto dagli anziani , dai capi dei sacerdoti e dagli scribi , sia ucciso e risusciti il terzo giorno » . Il prezzo del discepolato
NR2006	Luca	9	23	M omette ogni giorno . - Luca
NR2006	Luca	9	24	Perché chi vorrà salvare la sua vita la perderà , ma chi avrà perduto la propria vita per causa mia la salverà .
NR2006	Luca	9	25	Infatti , che serve all ’ uomo guadagnare tutto il mondo , se poi perde o rovina se stesso ?
NR2006	Luca	9	26	Perché se uno ha vergogna di me e delle mie parole , il Figlio dell ’ uomo avrà vergogna di lui , quando verrà nella gloria sua e del Padre e dei santi angeli .
NR2006	Luca	9	27	Ora io vi dico in verità che alcuni di quelli che sono qui presenti non gusteranno la morte , finché non abbiano visto il regno di Dio » . La trasfigurazione
NR2006	Luca	9	28	( F ) Circa otto giorni dopo questi discorsi , Gesù prese con sé Pietro , Giovanni e Giacomo , e salì sul monte a pregare .
NR2006	Luca	9	29	Mentre pregava , l ’ aspetto del suo volto fu mutato e la sua veste divenne di un candore sfolgorante .
NR2006	Luca	9	30	Ed ecco , due uomini conversavano con lui : erano Mosè ed Elia ,
NR2006	Luca	9	31	i quali , apparsi in gloria , parlavano della sua dipartita che stava per compiersi in Gerusalemme .
NR2006	Luca	9	32	E , quando si furono svegliati , altri traducono : ma , essendo rimasti svegli . - Luca
NR2006	Luca	9	33	Come questi si separavano da lui , Pietro disse a Gesù : « Maestro , è bene che stiamo qui ; facciamo tre tende : una per te , una per Mosè e una per Elia » . Egli non sapeva quello che diceva .
NR2006	Luca	9	34	TR e M quelli . - Luca
NR2006	Luca	9	35	TR e M questo è il mio Figlio diletto ; ascoltatelo . - Luca
NR2006	Luca	9	36	Mentre la voce parlava , Gesù si trovò solo . Ed essi tacquero e in quei giorni non riferirono nulla a nessuno di quello che avevano visto . Guarigione di un indemoniato
NR2006	Luca	9	37	( G ) Il giorno seguente , quando essi scesero dal monte , una gran folla andò incontro a Gesù .
NR2006	Luca	9	38	Un uomo dalla folla gridò : « Maestro , ti prego , volgi lo sguardo a mio figlio : è l ’ unico che io abbia .
NR2006	Luca	9	39	Ecco , uno spirito si impadronisce di lui e subito egli grida ; e lo spirito lo contorce , facendolo schiumare , e a fatica si allontana da lui , dopo averlo straziato .
NR2006	Luca	9	40	Ho pregato i tuoi discepoli di scacciarlo , ma non hanno potuto » .
NR2006	Luca	9	41	Gesù rispose : « O generazione incredula e perversa , fino a quando sarò con voi e vi sopporterò ? Porta qui tuo figlio » .
NR2006	Luca	9	42	Mentre il ragazzo si avvicinava , il demonio lo gettò per terra e cominciò a contorcerlo con le convulsioni ; ma Gesù sgridò lo spirito immondo , guarì il ragazzo e lo rese a suo padre .
NR2006	Luca	9	43	E tutti rimasero sbalorditi della grandezza di Dio . Mentre tutti si meravigliavano di tutte le cose che &#91; Gesù &#93; faceva , egli disse ai suoi discepoli :
NR2006	Luca	9	44	Tenete bene in mente , lett. mettetevi negli orecchi . - Luca
NR2006	Luca	9	45	Ma essi non capivano queste parole che erano per loro velate , così da risultare incomprensibili , e temevano di interrogarlo su quanto aveva detto . L ’ umiltà , segreto della vera grandezza ; condanna dello spirito settario
NR2006	Luca	9	46	( I ) Poi cominciarono a discutere su chi di loro fosse il più grande .
NR2006	Luca	9	47	Ma Gesù , conosciuto il pensiero del loro cuore , prese un bambino , se lo pose accanto e disse loro :
NR2006	Luca	9	48	TR e M quello sarà grande . - Luca
NR2006	Luca	9	49	TR i demòni . - Luca
NR2006	Luca	9	50	TR e M chi non è contro di noi è per noi . - Luca
NR2006	Luca	9	51	( J ) Poi , mentre si avvicinava il tempo in cui sarebbe stato tolto dal mondo , Gesù si mise risolutamente in cammino per andare a Gerusalemme .
NR2006	Luca	9	52	Mandò davanti a sé dei messaggeri , i quali , partiti , entrarono in un villaggio dei Samaritani per preparargli un alloggio .
NR2006	Luca	9	53	Questo comportamento era dovuto all ’ ostilità tradizionale fra Samaritani e Giudei ; cfr . Gv
NR2006	Luca	9	54	""
NR2006	Luca	9	55	Ma egli si voltò verso di loro e li sgridò . &#91; E disse : « Voi non sapete di quale spirito siete animati .
NR2006	Luca	9	56	Poiché il Figlio dell ’ uomo non è venuto per perdere le anime degli uomini , ma per salvarle » . &#93; E se ne andarono in un altro villaggio . Come seguire Gesù
NR2006	Luca	9	57	TR e M Signore , io ti seguirò … - Luca
NR2006	Luca	9	58	E Gesù gli rispose : « Le volpi hanno delle tane e gli uccelli del cielo dei nidi , ma il Figlio dell ’ uomo non ha dove posare il capo » .
NR2006	Luca	9	59	A un altro disse : « Seguimi » . Ed egli rispose : « { Signore , } permettimi di andare prima a seppellire mio padre » .
NR2006	Luca	9	60	TR e M Ma Gesù …
NR2006	Luca	9	61	Un altro ancora gli disse : « Ti seguirò , Signore , ma lasciami prima salutare quelli di casa mia » .
NR2006	Luca	9	62	Ma Gesù { gli disse } : « Nessuno che abbia messo la mano all ’ aratro e poi volga lo sguardo indietro è adatto per il regno di Dio » . Footnotes - Luca
NR2006	Luca	9	1	:
NR2006	Luca	10	10	:
NR2006	Luca	10	2006	La missione dei settanta discepoli
NR2006	Luca	10	2	E diceva loro : « La mèsse è grande , ma gli operai sono pochi ; pregate dunque il Signore della mèsse perché spinga degli operai nella sua mèsse .
NR2006	Luca	10	3	Andate ! Ecco , io vi mando come agnelli in mezzo ai lupi .
NR2006	Luca	10	4	Non portate né borsa , né sacca , né calzari , e non salutate nessuno per via .
NR2006	Luca	10	5	. - Luca
NR2006	Luca	10	6	:
NR2006	Luca	10	7	""
NR2006	Luca	10	8	In qualunque città entriate , se vi ricevono , mangiate ciò che vi sarà messo davanti ,
NR2006	Luca	10	9	guarite i malati che ci saranno e dite loro : “ Il regno di Dio si è avvicinato a voi ” .
NR2006	Luca	10	11	Così TR e M ; NA omette a voi rendendo la frase : il regno di Dio è vicino . - Luca
NR2006	Luca	10	12	TR Ma io vi dico . - Luca
NR2006	Luca	10	13	( B ) « Guai a te , Corazin ! Guai a te , Betsàida ! Perché se in Tiro e in Sidone fossero state fatte le opere potenti compiute tra di voi , già da tempo si sarebbero ravvedute , sedendo con sacco e cenere .
NR2006	Luca	10	14	Perciò , nel giudizio , la sorte di Tiro e di Sidone sarà più tollerabile della vostra .
NR2006	Luca	10	15	TR e M … Capernaum , che sei stata innalzata fino al cielo , sarai abbassata fino all ’ Ades . - Luca
NR2006	Luca	10	16	Chi ascolta voi ascolta me ; chi respinge voi respinge me , e chi rifiuta me rifiuta Colui che mi ha mandato » .
NR2006	Luca	10	17	alcuni mss. riportano settantadue . - Luca
NR2006	Luca	10	18	. - Luca
NR2006	Luca	10	19	:
NR2006	Luca	10	20	TR ma rallegratevi piuttosto … - Luca
NR2006	Luca	10	21	Mosso dallo Spirito Santo , esultò , lett. esultò nello Spirito Santo ; TR e M esultò nello spirito . - Luca
NR2006	Luca	10	22	M E rivolgendosi ai discepoli disse , ogni cosa … - Luca
NR2006	Luca	10	23	E , rivolgendosi ai discepoli , disse loro privatamente : « Beati gli occhi che vedono quello che voi vedete !
NR2006	Luca	10	24	Perché vi dico che molti profeti e re hanno desiderato vedere quello che voi vedete , e non l ’ hanno visto ; e udire quello che voi udite , e non l ’ hanno udito » . Il buon Samaritano
NR2006	Luca	10	25	( D ) Ed ecco , un dottore della legge si alzò per metterlo alla prova , dicendo : « Maestro , che devo fare per ereditare la vita eterna ? »
NR2006	Luca	10	26	Gesù gli disse : « Nella legge che cosa sta scritto ? Come leggi ? »
NR2006	Luca	10	27	+ Le
NR2006	Luca	10	28	Gesù gli disse : « Hai risposto esattamente ; fa ’ questo e vivrai » .
NR2006	Luca	10	29	Ma egli , volendo giustificarsi , disse a Gesù : « E chi è il mio prossimo ? »
NR2006	Luca	10	30	Gesù rispose : « Un uomo scendeva da Gerusalemme a Gerico e s ’ imbatté nei briganti , che lo spogliarono , lo ferirono e poi se ne andarono , lasciandolo mezzo morto .
NR2006	Luca	10	31	Per caso un sacerdote scendeva per quella stessa strada , ma quando lo vide , passò oltre dal lato opposto .
NR2006	Luca	10	32	Così pure un Levita , quando giunse in quel luogo e lo vide , passò oltre dal lato opposto .
NR2006	Luca	10	33	Ma un Samaritano , che era in viaggio , giunse presso di lui e , vedendolo , ne ebbe pietà ;
NR2006	Luca	10	34	avvicinatosi , fasciò le sue piaghe versandovi sopra olio e vino , poi lo mise sulla propria cavalcatura , lo condusse a una locanda e si prese cura di lui .
NR2006	Luca	10	35	Il giorno dopo &#91; , prima di partire &#93; , presi due denari , li diede all ’ oste e &#91; gli &#93; disse : “ Prenditi cura di lui ; e tutto ciò che spenderai di più , te lo rimborserò al mio ritorno ” .
NR2006	Luca	10	36	Quale &#91; dunque &#93; di questi tre ti pare essere stato il prossimo di colui che s ’ imbatté nei ladroni ? »
NR2006	Luca	10	37	Quegli &#91; quindi &#93; rispose : « Colui che gli usò misericordia » . Gesù gli disse : « Va ’ , e fa ’ anche tu la stessa cosa » . Marta e Maria
NR2006	Luca	10	38	TR e M Or avvenne che mentre … - Luca
NR2006	Luca	10	39	TR e M ai piedi di Gesù . - Luca
NR2006	Luca	10	40	Ma Marta , tutta presa dalle faccende domestiche , venne e disse : « Signore , non ti importa che mia sorella mi abbia lasciata sola a servire ? Dille dunque che mi aiuti » .
NR2006	Luca	10	41	Alcuni mss. hanno : ma di poche cose c ’ è bisogno , oppure : ma di poche cose o di una sola c ’ è bisogno .
NR2006	Luca	10	42	Maria ha scelto la parte buona che non le sarà tolta » . Footnotes - Luca
NR2006	Luca	10	1	Ti
NR2006	Luca	11	11	:
NR2006	Luca	11	2006	Istruzioni di Gesù sulla preghiera
NR2006	Luca	11	2	Egli disse loro : « Quando pregate , dite : “ Padre &#91; nostro che sei nei cieli &#93; , sia santificato il tuo nome ; venga il tuo regno &#91; ; sia fatta la tua volontà , come in cielo , anche in terra &#93; ;
NR2006	Luca	11	3	Vd. nota a Mt
NR2006	Luca	11	4	e perdonaci i nostri peccati , perché anche noi perdoniamo a ogni nostro debitore ; e non ci esporre alla tentazione &#91; , ma liberaci dal maligno &#93; ” » .
NR2006	Luca	11	5	:
NR2006	Luca	11	6	:
NR2006	Luca	11	7	e se quello dal di dentro gli risponde : “ Non darmi fastidio ; la porta è già chiusa e i miei bambini sono con me a letto , io non posso alzarmi per darteli ” ,
NR2006	Luca	11	8	Per la sua importunità , altri traducono : per la sua insistenza . - Luca
NR2006	Luca	11	9	Io altresì vi dico : chiedete e vi sarà dato ; cercate e troverete ; bussate e vi sarà aperto .
NR2006	Luca	11	10	Perché chiunque chiede riceve , chi cerca trova , e sarà aperto a chi bussa .
NR2006	Luca	11	12	Oppure se gli chiede un uovo , gli dia uno scorpione ?
NR2006	Luca	11	13	Se voi , dunque , che siete malvagi , sapete dare buoni doni ai vostri figli , quanto più il Padre celeste donerà lo Spirito Santo a coloro che glielo chiedono ! » Guarigione di un indemoniato
NR2006	Luca	11	14	( C ) Gesù stava scacciando un demonio { che era muto } ; e , quando il demonio fu uscito , il muto parlò e la folla si stupì .
NR2006	Luca	11	15	. - Luca
NR2006	Luca	11	16	Altri , per metterlo alla prova , gli chiedevano un segno dal cielo .
NR2006	Luca	11	17	Ma egli , conoscendo i loro pensieri , disse loro : « Ogni regno diviso contro se stesso va in rovina , e casa crolla su casa .
NR2006	Luca	11	18	Se dunque anche Satana è diviso contro se stesso , come potrà reggere il suo regno ? Poiché voi dite che è per l ’ aiuto di Belzebù che io scaccio i demòni .
NR2006	Luca	11	19	E se io scaccio i demòni con l ’ aiuto di Belzebù , con l ’ aiuto di chi li scacciano i vostri figli ? Perciò , essi stessi saranno i vostri giudici .
NR2006	Luca	11	20	Ma se è con il dito di Dio che io scaccio i demòni , allora il regno di Dio è giunto fino a voi .
NR2006	Luca	11	21	Quando l ’ uomo forte , ben armato , guarda l ’ ingresso della sua casa , ciò che egli possiede è al sicuro ;
NR2006	Luca	11	22	ma quando uno più forte di lui sopraggiunge e lo vince , gli toglie tutta l ’ armatura nella quale confidava e ne divide il bottino .
NR2006	Luca	11	23	. - Luca
NR2006	Luca	11	24	( D ) « Quando lo spirito immondo esce da un uomo , si aggira per luoghi aridi , cercando riposo ; e , non trovandone , dice : “ Ritornerò nella mia casa , dalla quale sono uscito ” ;
NR2006	Luca	11	25	e , quando ci arriva , la trova spazzata e adorna .
NR2006	Luca	11	26	Allora va e prende con sé altri sette spiriti peggiori di lui , ed entrano ad abitarla ; e l ’ ultima condizione di quell ’ uomo diventa peggiore della prima » .
NR2006	Luca	11	27	( E ) Mentre egli diceva queste cose , dalla folla una donna alzò la voce e gli disse : « Beato il grembo che ti portò e le mammelle che tu poppasti ! » Ma egli disse :
NR2006	Luca	11	28	« Beati piuttosto quelli che ascoltano la parola di Dio e la osservano ! » Il segno del profeta Giona
NR2006	Luca	11	29	TR e M del profeta Giona . - Luca
NR2006	Luca	11	30	Infatti , come Giona fu un segno per i Niniviti , così anche il Figlio dell ’ uomo lo sarà per questa generazione .
NR2006	Luca	11	31	La regina del mezzogiorno comparirà nel giudizio con gli uomini di questa generazione e li condannerà , perché ella venne dalle estremità della terra per udire la sapienza di Salomone ; ed ecco , qui c ’ è più di Salomone .
NR2006	Luca	11	32	I Niniviti compariranno nel giudizio con questa generazione e la condanneranno , perché essi si ravvidero alla predicazione di Giona ; ed ecco , qui c ’ è più di Giona . Parabola della lampada e dell ’ occhio
NR2006	Luca	11	33	Vd. nota a Mt
NR2006	Luca	11	34	Malvagio , vd. nota a Mt
NR2006	Luca	11	35	Sta quindi attento che la luce che è in te non sia tenebre .
NR2006	Luca	11	36	Se dunque tutto il tuo corpo è illuminato , senza avere alcuna parte tenebrosa , sarà tutto illuminato come quando la lampada t ’ illumina con il suo splendore » . Gesù condanna i farisei
NR2006	Luca	11	37	( H ) Mentre egli parlava , un fariseo lo invitò a pranzo da lui . Egli entrò e si mise a tavola .
NR2006	Luca	11	38	Il fariseo , veduto questo , si meravigliò che non si fosse lavato prima del pranzo .
NR2006	Luca	11	39	Il Signore gli disse : « Voi farisei pulite l ’ esterno della coppa e del piatto , ma il vostro interno è pieno di rapina e di malvagità .
NR2006	Luca	11	40	Stolti , Colui che ha fatto l ’ esterno non ha fatto anche l ’ interno ?
NR2006	Luca	11	41	Quello che è dentro il piatto , lett. quello che è interno / dentro . - Luca
NR2006	Luca	11	42	TR e M senza lasciare le altre . - Luca
NR2006	Luca	11	43	Guai a voi , farisei , perché amate i primi seggi nelle sinagoghe e i saluti nelle piazze .
NR2006	Luca	11	44	Guai a voi &#91; scribi e farisei ipocriti &#93; , perché siete come quei sepolcri che non si vedono , e le persone vi camminano sopra senza saperlo » .
NR2006	Luca	11	45	Allora uno dei dottori della legge , rispondendo , gli disse : « Maestro , parlando così , offendi anche noi » .
NR2006	Luca	11	46	Ed egli disse : « Guai anche a voi , dottori della legge , perché caricate la gente di pesi difficili da portare , e voi non toccate quei pesi neppure con un dito !
